id,texto
1,"O impacto das redes sociais na sociedade contemporânea e uma coisa ruim que precisa pensar. Tem muita coisa errada e não ajuda ninguém."
2,"É muito complicado fala de Desafios da mobilidade urbana no Brasil. As pessoa sofrem, o governo nao ajuda. Isso é triste."
3,"As coisas não tão boa com esse negócio de A importância da saúde mental na juventude. Tudo difícil, ninguém liga."
4,"Esse problema de Meio ambiente e desenvolvimento sustentável é chato e ninguem resolve. O Brasil tá ruim."
5,"O papel da educação no combate à desigualdade social deveria ser resolvido, mas ninguém faz nada. Só piora."
6,"A situação do O impacto das redes sociais na sociedade contemporânea é ruim. Todo mundo sofre e nada muda."
7,"O Desafios da mobilidade urbana no Brasil precisa ser visto. Tá ruim demais."
8,"Sobre A importância da saúde mental na juventude, dá pra ver que tudo tá errado. Ninguém liga."
9,"Meio ambiente e desenvolvimento sustentável não tá certo. As pessoa tenta, mas não dá."
10,"Esse tema é ruim. Tem que mudar tudo."

11,"O tema Meio ambiente e desenvolvimento sustentável mostra muitos problemas. A sociedade não se importa tanto como deveria."
12,"Mesmo com dificuldades, A importância da saúde mental na juventude é um assunto necessário. Falta atitude do governo."
13,"As pessoas sofrem com Desafios da mobilidade urbana no Brasil. Não tem ajuda suficiente."
14,"O problema de O papel da educação no combate à desigualdade social é sério. Precisa de mais atenção."
15,"Falar sobre O impacto das redes sociais na sociedade contemporânea é importante, mas ninguém faz nada."
16,"A gente vê que A importância da saúde mental na juventude causa dor nas pessoas."
17,"Desafios da mobilidade urbana no Brasil deveria ser tratado com mais respeito."
18,"O governo ignora O papel da educação no combate à desigualdade social e isso é ruim."
19,"O impacto das redes sociais na sociedade contemporânea prejudica muita gente."
20,"É preciso olhar para o problema de Meio ambiente e desenvolvimento sustentável com mais cuidado."

21,"O impacto das redes sociais na sociedade contemporânea representa um desafio real na sociedade. As pessoas sentem os impactos."
22,"Com o avanço da tecnologia, o tema Desafios da mobilidade urbana no Brasil se torna mais visível."
23,"Apesar de políticas públicas, A importância da saúde mental na juventude ainda é um problema grave."
24,"Meio ambiente e desenvolvimento sustentável atinge várias camadas da população e precisa de soluções."
25,"É urgente repensar as atitudes sociais sobre O papel da educação no combate à desigualdade social."
26,"A questão de O impacto das redes sociais na sociedade contemporânea exige ações mais diretas."
27,"Mesmo discutido, Desafios da mobilidade urbana no Brasil continua sem solução clara."
28,"O Brasil sofre com a falta de ações concretas sobre A importância da saúde mental na juventude."
29,"Meio ambiente e desenvolvimento sustentável deve ser combatido com educação e políticas sociais."
30,"O debate sobre O papel da educação no combate à desigualdade social precisa de mais espaço na mídia e nas escolas."

31,"Discussões sobre O impacto das redes sociais na sociedade contemporânea apontam que há descaso com a população."
32,"O descaso governamental com relação a Desafios da mobilidade urbana no Brasil acentua desigualdades."
33,"A importância da saúde mental na juventude é um reflexo da ausência de políticas efetivas."
34,"A sociedade precisa se engajar mais com o tema Meio ambiente e desenvolvimento sustentável."
35,"O enfrentamento de O papel da educação no combate à desigualdade social exige vontade política."
36,"Meio ambiente e desenvolvimento sustentável é um desafio coletivo que ainda não é enfrentado com seriedade."
37,"A falta de debate qualificado sobre O impacto das redes sociais na sociedade contemporânea prejudica o avanço."
38,"Desafios da mobilidade urbana no Brasil ainda sofre com estigmas sociais."
39,"Campanhas de conscientização são uma alternativa contra A importância da saúde mental na juventude."
40,"A educação pode ser um caminho para solucionar O papel da educação no combate à desigualdade social."

41,"As redes sociais transformaram a forma como interagimos, mas também trouxeram desafios, como a disseminação de fake news e o isolamento social. Isso demonstra a necessidade de um uso mais consciente da tecnologia."
42,"O crescimento urbano desordenado contribui para os Desafios da mobilidade urbana no Brasil. Investimentos em transporte público de qualidade são urgentes para garantir acessibilidade à população."
43,"A juventude enfrenta pressões sociais e acadêmicas que impactam diretamente sua saúde mental. É necessário promover o diálogo nas escolas e a presença de profissionais capacitados nesse contexto."
44,"A preservação do meio ambiente exige uma mudança de comportamento coletivo. O desenvolvimento sustentável depende de ações conjuntas entre Estado, empresas e indivíduos."
45,"A educação é uma ferramenta essencial para combater a desigualdade social. Políticas públicas que garantam acesso à educação de qualidade são fundamentais para transformar realidades."
46,"O impacto das redes sociais é ambivalente: aproximam pessoas, mas também criam bolhas de pensamento. Isso reforça a necessidade de educação digital nas escolas."
47,"A mobilidade urbana está ligada à qualidade de vida nos centros urbanos. A falta de planejamento e infraestrutura adequada prejudica o deslocamento da população de baixa renda."
48,"Problemas de saúde mental entre jovens têm crescido. Campanhas educativas, aliadas ao suporte psicológico, são fundamentais para prevenir transtornos mais graves."
49,"A degradação ambiental e o consumo excessivo mostram que o modelo atual é insustentável. Investir em tecnologias limpas é um caminho para conciliar crescimento econômico e preservação."
50,"A desigualdade social no Brasil tem raízes históricas. A educação, se universal e de qualidade, pode ser uma ponte para a inclusão e justiça social."

51,"Redes sociais são importantes para comunicação, mas têm gerado problemas como vício e desinformação. A regulação e a educação digital podem reduzir seus impactos negativos."
52,"No Brasil, os desafios da mobilidade urbana afetam milhões. Alternativas como ciclovias, transporte público eficiente e planejamento urbano são soluções viáveis."
53,"A saúde mental na juventude precisa ser tratada com a mesma importância da saúde física. O apoio emocional na escola e em casa deve ser incentivado."
54,"A crise climática e a poluição indicam que o planeta precisa de atenção. Ações sustentáveis nas cidades e no campo são essenciais para reverter esse cenário."
55,"Combater a desigualdade social exige mais do que distribuição de renda: é necessário garantir oportunidades, principalmente por meio da educação básica de qualidade."
56,"A influência das redes sociais na formação da opinião pública é evidente. A alfabetização midiática se mostra indispensável para evitar a manipulação digital."
57,"O transporte público precário nas grandes cidades reflete a negligência com a mobilidade urbana. Isso afeta principalmente as populações mais vulneráveis."
58,"A adolescência é um período sensível. Com o aumento de casos de ansiedade e depressão, torna-se urgente a valorização da saúde mental nas políticas públicas."
59,"Recursos naturais são finitos. A educação ambiental e o consumo consciente devem ser incorporados ao cotidiano desde cedo."
60,"A escola é um espaço de transformação. Ao oferecer uma formação inclusiva e crítica, contribui significativamente para a diminuição das desigualdades sociais."

61,"O advento das redes sociais modificou profundamente as relações interpessoais e a difusão de informações. Embora tenham promovido avanços na comunicação, também contribuíram para a proliferação de notícias falsas e discursos de ódio. Portanto, é essencial investir em educação digital e fomentar o pensamento crítico desde a juventude."
62,"Os desafios da mobilidade urbana no Brasil estão intrinsecamente ligados à falta de planejamento e à desigualdade social. A concentração de investimentos em transporte individual, em detrimento do coletivo, aprofunda problemas como congestionamentos e exclusão. É urgente repensar políticas públicas que priorizem acessibilidade e sustentabilidade."
63,"A saúde mental dos jovens é frequentemente negligenciada, apesar de sua importância. Fatores como pressão acadêmica, redes sociais e falta de diálogo contribuem para o aumento de casos de depressão e ansiedade. A escola, enquanto espaço formativo, deve promover ações de escuta e acolhimento, com apoio de profissionais especializados."
64,"O meio ambiente sofre com a exploração desenfreada de recursos naturais, agravando a crise climática. O desenvolvimento sustentável surge como alternativa necessária, aliando progresso econômico à preservação ambiental. Incentivar práticas conscientes e investir em tecnologias limpas é o caminho para garantir o futuro do planeta."
65,"A educação é uma ferramenta poderosa para a redução das desigualdades sociais. Ao proporcionar acesso ao conhecimento e à reflexão crítica, forma cidadãos conscientes de seus direitos. Políticas públicas que garantam educação básica e superior de qualidade, especialmente em áreas vulneráveis, são indispensáveis."
66,"O uso indiscriminado das redes sociais tem provocado efeitos colaterais na saúde mental e na coesão social. É preciso regulamentar o ambiente digital, responsabilizando plataformas e promovendo a alfabetização midiática para garantir um uso ético e consciente dessas ferramentas."
67,"O crescimento urbano desordenado intensifica os desafios da mobilidade, sobretudo nas periferias. A criação de corredores de ônibus, ciclovias e sistemas integrados de transporte pode contribuir significativamente para a redução das desigualdades no deslocamento urbano."
68,"A adolescência é um período marcado por transformações. Quando a saúde mental não é tratada com seriedade, há riscos de evasão escolar, automutilação e até suicídio. Projetos de apoio psicológico nas escolas são medidas fundamentais para mudar esse cenário."
69,"A preservação ambiental é um desafio global. Iniciativas locais, como coleta seletiva e reflorestamento, aliadas a ações governamentais mais amplas, são cruciais para mitigar os impactos ambientais e promover o equilíbrio ecológico."
70,"Promover uma educação equitativa requer mais do que acesso físico à escola. É necessário garantir permanência, qualidade de ensino e valorização dos profissionais da educação. Assim, o combate à desigualdade social se torna mais efetivo."

71,"As redes sociais representam uma das principais transformações do século XXI. Ao mesmo tempo que democratizam o acesso à informação, também favorecem a propagação de discursos antidemocráticos. Cabe ao Estado e à sociedade civil estimular o uso responsável dessas ferramentas, por meio da educação crítica."
72,"A mobilidade urbana nas grandes cidades brasileiras é marcada por exclusão e ineficiência. Soluções inteligentes, como transporte público integrado, incentivo ao uso de bicicletas e reurbanização, devem ser implementadas com urgência para melhorar a qualidade de vida urbana."
73,"A saúde mental da juventude deve ser tratada como uma questão de saúde pública. Investimentos em atendimento psicológico nas escolas e campanhas de conscientização são estratégias fundamentais para prevenir quadros graves e garantir o bem-estar dos estudantes."
74,"A crise ambiental exige posturas firmes da sociedade e do Estado. A transição para uma economia verde, pautada em energias renováveis e na educação ambiental, é essencial para a construção de um futuro sustentável e justo para as próximas gerações."
75,"A desigualdade social no Brasil tem origem em um histórico processo de exclusão. A educação pode funcionar como um motor de transformação, desde que seja garantido o acesso igualitário a recursos, infraestrutura e formação docente de qualidade."
76,"A internet, por meio das redes sociais, ampliou a voz dos cidadãos. No entanto, também ampliou a desinformação. A regulamentação responsável dessas plataformas, associada ao letramento digital, pode minimizar seus impactos negativos sobre a democracia."
77,"O planejamento urbano deficiente acarreta problemas de mobilidade e impacto ambiental. Cidades mais sustentáveis dependem de políticas públicas que priorizem o transporte coletivo, incentivem a descentralização dos serviços e combatam a segregação espacial."
78,"O aumento de transtornos mentais entre jovens evidencia a falência de um sistema educacional que pouco considera o emocional. Implementar políticas de cuidado, com psicólogos nas escolas e projetos de autocuidado, é essencial para prevenir crises mais graves."
79,"A preservação ambiental não deve ser apenas um discurso. Ações práticas, como incentivo à agricultura sustentável, preservação de biomas e educação ambiental, devem ser integradas às políticas públicas."
80,"A educação transforma realidades. Investir em escolas de tempo integral, valorização do professor e acesso à cultura é uma forma concreta de combater a desigualdade social e promover cidadania ativa."

81,"O uso massivo das redes sociais alterou significativamente as formas de sociabilidade e participação política. Embora promovam a conexão entre indivíduos, também favorecem a disseminação de discursos de ódio e desinformação. Nesse cenário, cabe ao Estado regulamentar o ambiente virtual e promover a educação digital como ferramenta de formação crítica do cidadão."
82,"A mobilidade urbana no Brasil reflete a exclusão histórica de parcelas vulneráveis da sociedade. A priorização de transportes individuais em detrimento do coletivo acentua desigualdades. Assim, políticas públicas que incentivem o transporte sustentável e garantam acessibilidade são fundamentais para assegurar o direito de ir e vir."
83,"A negligência em relação à saúde mental na juventude tem raízes em uma cultura que ainda estigmatiza o sofrimento psíquico. Para combater esse problema, é necessário implementar programas educacionais que incentivem o diálogo sobre emoções e disponibilizar equipes multidisciplinares nas instituições de ensino."
84,"O modelo de desenvolvimento vigente, centrado no consumo e na exploração excessiva dos recursos naturais, revela-se insustentável. Diante disso, a transição para práticas sustentáveis, como energias limpas e economia circular, deve ser promovida com urgência, aliada a uma forte política de educação ambiental."
85,"A educação é a principal ferramenta de transformação social. No contexto brasileiro, marcada por profundas desigualdades, garantir acesso equitativo a uma educação de qualidade é essencial para romper o ciclo da pobreza e construir uma sociedade mais justa e democrática."
86,"As redes sociais, ao mesmo tempo que democratizam a informação, favorecem a polarização e a superficialidade do debate público. Cabe à escola, nesse contexto, promover o letramento digital, capacitando os jovens a distinguir fatos de opiniões e a consumir informação de forma crítica e ética."
87,"O caos urbano vivido nas metrópoles brasileiras é resultado de uma política de mobilidade centrada no transporte individual. A construção de uma cidade inclusiva exige investimentos em transporte coletivo eficiente, planejamento urbano integrado e ações voltadas à sustentabilidade."
88,"A adolescência é um período vulnerável, marcado por intensas transformações. Quando negligenciada, a saúde mental nessa fase pode comprometer o desenvolvimento integral do indivíduo. Por isso, é fundamental que o Estado invista em políticas públicas que promovam o acolhimento e a escuta ativa nas escolas."
89,"A crise ambiental global revela a urgência de uma nova postura civilizacional. É preciso substituir o paradigma extrativista por um modelo de coexistência harmônica com a natureza. Educação, inovação tecnológica e responsabilização das grandes corporações são pilares indispensáveis dessa mudança."
90,"A desigualdade social brasileira é fruto de um passado escravocrata e de políticas excludentes. A única forma de superá-la de maneira efetiva é por meio da valorização da escola pública, da formação docente contínua e da promoção de uma educação emancipadora, crítica e humanista."

91,"As redes sociais têm papel central na formação de opiniões, influenciando desde eleições até comportamentos cotidianos. No entanto, o uso irresponsável dessas plataformas tem gerado danos sociais graves. Nesse contexto, a atuação conjunta do poder público, das empresas de tecnologia e da sociedade civil é essencial para garantir um ambiente digital ético e seguro."
92,"O sistema de transporte brasileiro revela uma lógica excludente que perpetua desigualdades. É preciso adotar uma abordagem sustentável, com investimentos em transporte público de qualidade, integração modal e incentivo à mobilidade ativa. Assim, promove-se o direito à cidade de forma equânime."
93,"A saúde mental dos jovens, frequentemente invisibilizada, é atravessada por fatores sociais, escolares e familiares. A construção de uma cultura de cuidado requer, portanto, políticas públicas que articulem diferentes setores, como saúde, educação e assistência social, de maneira intersetorial e humanizada."
94,"A degradação ambiental, impulsionada por um modelo de desenvolvimento predatório, compromete o futuro das próximas gerações. Para reverter esse quadro, é necessário fomentar práticas sustentáveis, responsabilizar agentes poluentes e investir massivamente em educação ecológica e conscientização coletiva."
95,"A educação, além de direito fundamental, é instrumento de justiça social. A promoção de uma escola inclusiva, democrática e crítica é essencial para enfrentar desigualdades estruturais e garantir a efetiva cidadania de todos os brasileiros, especialmente dos grupos historicamente marginalizados."
96,"O cenário contemporâneo das redes sociais é marcado por paradoxos: liberdade e controle, inclusão e exclusão. Para equilibrar esses polos, é imprescindível que o Estado atue de forma reguladora, mas também que a escola exerça seu papel formativo na construção de cidadãos conscientes e responsáveis."
97,"A crise da mobilidade urbana brasileira exige um novo pacto civilizatório, no qual o transporte coletivo seja prioridade. Isso implica não apenas infraestrutura, mas também políticas de integração social que garantam o acesso de todas as classes à cidade e seus serviços."
98,"A juventude brasileira enfrenta desafios emocionais intensificados pelas pressões sociais e escolares. A presença de psicólogos nas escolas, aliada à formação emocional dos professores, é medida urgente para a promoção da saúde mental e do bem-estar no ambiente educacional."
99,"A mudança climática é um dos maiores desafios do século. O combate a esse fenômeno exige compromissos globais, mas também ações locais, como reflorestamento, redução do consumo de plástico e incentivo à energia limpa, articuladas por uma população educada ambientalmente."
100,"A superação da desigualdade social no Brasil passa, necessariamente, pela valorização da educação pública. Um sistema educacional que garanta equidade, qualidade e diversidade é a base para o desenvolvimento humano, social e econômico do país."